{
  "schemaVersion": "training.corpus-manifest.v1",
  "manifestId": "corpus.teacher.smoke-slice",
  "version": "1.0.0",
  "title": "Teacher smoke corpus slice (UND + RET reference)",
  "consentClass": "synthetic",
  "laneCodes": ["teacher", "smoke"],
  "knowledgeModes": ["UND", "RET"],
  "sources": [
    {
      "sourceId": "src.teacher.und.ratios",
      "relpath": "fixtures/sources/teacher-und-ratios.jsonl",
      "licenseId": "lic.cc-by-4.0",
      "knowledgeMode": "UND",
      "laneCode": "teacher",
      "contentHash": "sha256:6e45343a5e2827d7e1f5cc787cff1aa3d7c2c9d57a8943f5861ef0fde5a80182"
    },
    {
      "sourceId": "src.teacher.ret.syllabus",
      "relpath": "fixtures/sources/teacher-ret-syllabus.jsonl",
      "licenseId": "lic.cc-by-4.0",
      "knowledgeMode": "RET",
      "laneCode": "teacher",
      "contentHash": "sha256:6839b5c340060209ab009f5996c5d165b62e32843d28d78a7ca5240f7f6f593a"
    }
  ],
  "filters": [
    {
      "filterId": "flt.exclude-unknown-license",
      "kind": "exclude_unknown_license"
    },
    {
      "filterId": "flt.exclude-ret-weights",
      "kind": "exclude_ret_from_weights"
    },
    {
      "filterId": "flt.exclude-eval-overlap",
      "kind": "exclude_eval_overlap"
    }
  ],
  "dedupReport": {
    "status": "pending",
    "algorithm": "sha256+fuzzy",
    "fuzzyThreshold": 0.92,
    "laneThresholds": {
      "teacher": 0.92,
      "smoke": 0.95
    }
  },
  "licenseLedger": [
    {
      "licenseId": "lic.cc-by-4.0",
      "spdxOrLabel": "CC-BY-4.0",
      "licenseClass": "open"
    }
  ],
  "weightTrainingPolicy": {
    "excludeKnowledgeModes": ["RET"],
    "requireKnownLicense": true
  },
  "determinism": {
    "canonicalSort": true,
    "contentAddressedShards": true,
    "forbidWallClockInShardBytes": true
  },
  "decontaminationProof": {
    "status": "pending",
    "baselineRegistryRelpath": "training/eval/baseline_registry.json"
  }
}
